<?xml version="1.0" encoding="UTF-8" standalone="no"?>
<!DOCTYPE clients SYSTEM "clients.dtd">
<clients coulmn0="password:int" coulmn1="user:varchar" coulmn2="Age:int" sizeCol="3" sizeRow="4">
<row id="0">
<password>1234</password>
<user>mohamed ahmed</user>
<Age>1</Age>
</row>
<row id="1">
<password>1234</password>
<user>ahmed</user>
<Age>2</Age>
</row>
<row id="2">
<password>1234</password>
<user>ali</user>
<Age>3</Age>
</row>
<row id="3">
<password>1234</password>
<user>ali</user>
<Age> </Age>
</row>
</clients>
